{
  "unitNumber": 13,
  "subtitle": "Practice Set: Problems and Complete Solutions",
  "intro": "Work the following ten problems in order. They climb through Taylor coefficients and the standard library, the radius of convergence, a power-series solution at an ordinary point and the re-indexing that produces its recurrence, the Frobenius classification and indicial equation, and finally the classical special functions --- Legendre, Bessel, and the recurrence-built Hermite and Chebyshev polynomials.",
  "takeaway": {
    "title": "Unit Key Takeaway",
    "body": "Every problem above runs the same engine: \\highlight{assume an analytic (or Frobenius) ansatz, substitute, and match powers} to extract a recurrence. The ordinary-point case gives the two free constants $a_0,a_1$; the regular-singular case needs the $x^r$ factor and its indicial roots; and the named physical equations terminate or specialize into the \\highlight{classical orthogonal families}."
  },
  "problems": [
    {
      "id": "ps_13_1",
      "problem": "\\strong{(Maclaurin series)} Write the Maclaurin series of $e^x$ and state the coefficient of $x^4$.",
      "solution": " Every derivative of $e^x$ equals $e^x$, which is $1$ at $x=0$, so $a_n=f^{(n)}(0)/n!=1/n!$:\n\\[ \\work{e^x = \\sum_{n=0}^{\\infty}\\frac{x^n}{n!} = 1 + x + \\frac{x^2}{2} + \\frac{x^3}{6} + \\frac{x^4}{24} + \\cdots} \\]\nThe coefficient of $x^4$ is $\\dfrac{1}{4!}=\\dfrac{1}{24}$."
    },
    {
      "id": "ps_13_2",
      "problem": "\\strong{(Standard library)} Write the Maclaurin series of $\\cos x$ in summation form.",
      "solution": " Only even powers survive, with alternating sign:\n\\[ \\work{\\cos x = \\sum_{n=0}^{\\infty}\\frac{(-1)^n x^{2n}}{(2n)!} = 1 - \\frac{x^2}{2!} + \\frac{x^4}{4!} - \\cdots} \\]"
    },
    {
      "id": "ps_13_3",
      "problem": "\\strong{(Radius of convergence)} Use the ratio test to find the radius of convergence of $\\sum_{n=0}^{\\infty} \\dfrac{x^n}{2^n}$.",
      "solution": " With $a_n=1/2^n$, the ratio test gives\n\\[ \\work{\\frac{1}{R} = \\lim_{n\\to\\infty}\\left|\\frac{a_{n+1}}{a_n}\\right| = \\lim_{n\\to\\infty}\\frac{1/2^{n+1}}{1/2^n} = \\frac{1}{2} \\;\\Longrightarrow\\; R = 2.} \\]"
    },
    {
      "id": "ps_13_4",
      "problem": "\\strong{(Series at an ordinary point)} Substitute $y=\\sum a_n x^n$ into $y''+y=0$, derive the recurrence for $a_{n+2}$, and identify the two independent solutions.",
      "solution": " Re-index $y''=\\sum_{n\\ge 0}(n+2)(n+1)a_{n+2}x^n$ and add $y$:\n\\[ \\work{\\sum_{n=0}^{\\infty}\\big[(n+2)(n+1)a_{n+2}+a_n\\big]x^n = 0 \\;\\Longrightarrow\\; a_{n+2} = \\frac{-a_n}{(n+2)(n+1)}.} \\]\nThe $a_0$ branch builds $1-\\tfrac{x^2}{2!}+\\tfrac{x^4}{4!}-\\cdots=\\cos x$ and the $a_1$ branch builds $\\sin x$, so\n\\[ \\work{y = a_0\\cos x + a_1\\sin x.} \\]"
    },
    {
      "id": "ps_13_5",
      "problem": "\\strong{(Re-indexing)} For $y=\\sum_{n=0}^{\\infty} a_n x^n$, write $y''$ re-indexed so every term carries the common power $x^n$.",
      "solution": " Differentiate twice and shift the index by two so the power is $x^n$:\n\\[ \\work{y'' = \\sum_{n=0}^{\\infty}(n+2)(n+1)\\,a_{n+2}\\,x^n.} \\]\nForgetting the $(n+2)(n+1)$ factor here is the most common source of a wrong recurrence."
    },
    {
      "id": "ps_13_6",
      "problem": "\\strong{(Frobenius classification)} For $x^2 y'' + x y' - y = 0$, show $x=0$ is a regular singular point, compute $p_0$ and $q_0$, and solve the indicial equation.",
      "solution": " In standard form $y'' + \\tfrac{1}{x}y' - \\tfrac{1}{x^2}y = 0$, so $p=\\tfrac1x$, $q=-\\tfrac1{x^2}$. Since $xp=1$ and $x^2q=-1$ are analytic at $0$, the point is a regular singular point. Then\n\\[ \\work{p_0 = \\lim_{x\\to 0} x\\,p = 1, \\qquad q_0 = \\lim_{x\\to 0} x^2 q = -1,} \\]\n\\[ \\work{r(r-1)+r-1 = r^2-1 = 0 \\;\\Longrightarrow\\; r = \\pm 1.} \\]"
    },
    {
      "id": "ps_13_7",
      "problem": "\\strong{(Indicial roots)} Given $p_0=\\tfrac{3}{2}$ and $q_0=-\\tfrac{1}{2}$, solve the indicial equation $r(r-1)+p_0 r+q_0=0$.",
      "solution": " Substitute into the indicial equation and clear the fraction:\n\\[ \\work{r(r-1) + \\tfrac{3}{2}r - \\tfrac{1}{2} = r^2 + \\tfrac{1}{2}r - \\tfrac{1}{2} = 0 \\;\\Longrightarrow\\; 2r^2 + r - 1 = 0.} \\]\nFactor $(2r-1)(r+1)=0$:\n\\[ \\work{r = \\tfrac{1}{2} \\quad\\text{and}\\quad r = -1.} \\]"
    },
    {
      "id": "ps_13_8",
      "problem": "\\strong{(Legendre polynomial)} For $n=2$, Legendre's equation has a terminating solution. Find it and normalize so $P_2(1)=1$.",
      "solution": " For $n=2$ the even series terminates: $a_2 = -\\tfrac{n(n+1)}{2}a_0 = -3a_0$ and $a_4=0$, so $y=a_0(1-3x^2)$. Normalize with $P_2(1)=1$:\n\\[ \\work{a_0(1-3) = -2a_0 = 1 \\;\\Longrightarrow\\; a_0 = -\\tfrac{1}{2},} \\]\n\\[ \\work{P_2(x) = -\\tfrac{1}{2}(1-3x^2) = \\tfrac{1}{2}(3x^2-1).} \\]"
    },
    {
      "id": "ps_13_9",
      "problem": "\\strong{(Bessel's equation)} State Bessel's equation of order $\\nu$, classify the point $x=0$, and give the indicial roots.",
      "solution": " Bessel's equation of order $\\nu$ is\n\\[ \\work{x^2 y'' + x y' + (x^2 - \\nu^2)y = 0.} \\]\nAt $x=0$ the coefficients blow up but $xp$ and $x^2q$ are analytic, so it is a regular singular point; the indicial equation $r^2-\\nu^2=0$ gives\n\\[ \\work{r = \\nu \\quad\\text{and}\\quad r = -\\nu.} \\]"
    },
    {
      "id": "ps_13_10",
      "problem": "\\strong{(Classical families, capstone)} Using the Hermite recurrence $H_{n+1}=2xH_n-2nH_{n-1}$ and the Chebyshev recurrence $T_{n+1}=2xT_n-T_{n-1}$ (with $H_0=1,H_1=2x,T_0=1,T_1=x$), compute $H_2$ and $T_2$, and contrast them with $P_2$.",
      "solution": " Apply each recurrence once:\n\\[ \\work{H_2 = 2xH_1 - 2(1)H_0 = 2x(2x) - 2 = 4x^2 - 2,} \\]\n\\[ \\work{T_2 = 2xT_1 - T_0 = 2x(x) - 1 = 2x^2 - 1.} \\]\nAll three degree-2 members look alike but come from different equations and weights:\n\\[ \\work{H_2 = 4x^2-2, \\quad T_2 = 2x^2-1, \\quad P_2 = \\tfrac{1}{2}(3x^2-1).} \\]"
    }
  ]
}
