{
  "unitNumber": 3,
  "subtitle": "Practice Set: Problems and Complete Solutions",
  "intro": "Work the following ten problems in order. They climb from reading a slope field, through the phase plane and the existence--uniqueness test, into fixed points, contraction mappings, and a full Picard iteration. Solutions follow in Part III.",
  "takeaway": {
    "title": "Unit 3 Key Takeaway",
    "body": "This unit reads differential equations as \\highlight{geometry and\nguarantees} rather than formulas. A \\highlight{slope field} turns\n$y'=f(x,y)$ into a picture its integral curves follow; the\n\\highlight{phase plane} does the same for systems. The\n\\highlight{existence and uniqueness theorem} ($f$ and\n$\\partial f/\\partial y$ continuous) says exactly one curve threads each point,\nand \\highlight{Picard iteration via the Banach contraction\nprinciple} is the machine that proves it."
  },
  "problems": [
    {
      "id": "ps_3_1",
      "problem": "For the slope field of $\\dfrac{dy}{dx} = x + y$, find the slope at the point $(1,2)$ and the isocline along which every segment is horizontal.",
      "solution": " The slope is just $f$ evaluated at the point.\n\\[ \\work{f(1,2) = 1 + 2 = 3.} \\]\nThe horizontal segments lie on the isocline $f = 0$:\n\\[ \\work{x + y = 0 \\;\\Longrightarrow\\; y = -x.} \\]\n\n\\medskip"
    },
    {
      "id": "ps_3_2",
      "problem": "For $\\dfrac{dy}{dx} = y^{2} - x$, find the curve along which every field segment has slope $2$.",
      "solution": " Set $f$ equal to the target slope and solve.\n\\[ \\work{y^{2} - x = 2 \\;\\Longrightarrow\\; x = y^{2} - 2.} \\]\nEvery segment crossing the parabola $x = y^{2} - 2$ has slope $2$.\n\n\\medskip"
    },
    {
      "id": "ps_3_3",
      "problem": "For $\\dfrac{dy}{dx} = -\\dfrac{x}{y}$, find the slope of the segment at $(3,4)$, and describe the shape of the integral curves.",
      "solution": " Substitute, keeping the leading sign:\n\\[ \\work{f(3,4) = -\\frac{3}{4}.} \\]\nThe integral curves satisfy $y\\,dy = -x\\,dx$, so\n$\\work{\\frac{y^2}{2} = -\\frac{x^2}{2} + C_1}$, that is\n\\[ \\work{x^{2} + y^{2} = C} \\qquad\\text{(concentric circles).} \\]\n\n\\medskip"
    },
    {
      "id": "ps_3_4",
      "problem": "For the system $x' = y$, $y' = -x$, locate the equilibrium and classify it using the eigenvalues of its coefficient matrix.",
      "solution": " Equilibria need both derivatives zero:\n\\[ \\work{y = 0 \\text{ and } -x = 0 \\;\\Longrightarrow\\; (0,0).} \\]\nThe coefficient matrix\n$\\left(\\begin{smallmatrix}0&1\\\\-1&0\\end{smallmatrix}\\right)$ has characteristic\nequation $\\lambda^2 + 1 = 0$:\n\\[ \\work{\\lambda = \\pm i \\;\\;(\\text{purely imaginary}).} \\]\nPurely imaginary eigenvalues give a \\work{center}: trajectories\nare closed orbits circling the origin.\n\n\\medskip"
    },
    {
      "id": "ps_3_5",
      "problem": "For the linear system $x' = 2x$, $y' = 3y$, write the eigenvalues of the coefficient matrix and classify the origin.",
      "solution": " The system is decoupled, so the coefficient\nmatrix $\\left(\\begin{smallmatrix}2&0\\\\0&3\\end{smallmatrix}\\right)$ is diagonal\nand its eigenvalues sit on the diagonal:\n\\[ \\work{\\lambda_1 = 2, \\quad \\lambda_2 = 3.} \\]\nBoth are real and positive, so the origin is an\n\\work{unstable node (a source)} --- every nearby trajectory\nflows outward.\n\n\\medskip"
    },
    {
      "id": "ps_3_6",
      "problem": "For $\\dfrac{dy}{dx} = \\dfrac{x}{y - 2}$, determine where the existence and uniqueness theorem fails to guarantee a unique solution.",
      "solution": " Locate where $f$ and $\\frac{\\partial f}{\\partial y}$\nlose continuity. With $f = \\dfrac{x}{y-2}$,\n\\[ \\work{\\frac{\\partial f}{\\partial y} = -\\frac{x}{(y-2)^2},} \\]\nand both blow up when the denominator vanishes:\n\\[ \\work{y - 2 = 0 \\;\\Longrightarrow\\; y = 2.} \\]\nThe theorem fails to guarantee uniqueness along the line $y = 2$; everywhere\nelse a unique solution exists.\n\n\\medskip"
    },
    {
      "id": "ps_3_7",
      "problem": "Show that the initial value problem $\\dfrac{dy}{dx} = \\sqrt{y}$, $y(0) = 0$ has more than one solution, and explain which hypothesis of the theorem fails.",
      "solution": " Here $f = \\sqrt{y}$ is continuous at $y=0$,\nbut\n\\[ \\work{\\frac{\\partial f}{\\partial y} = \\frac{1}{2\\sqrt{y}}} \\]\nis \\emph{not} continuous at $y = 0$ --- it blows up. So uniqueness is not\nguaranteed, and indeed two solutions pass through the origin:\n\\[ \\work{y = 0} \\qquad\\text{and}\\qquad\n   \\work{y = \\frac{x^{2}}{4}} \\quad (x \\ge 0), \\]\nsince $\\frac{d}{dx}\\!\\left(\\frac{x^2}{4}\\right) = \\frac{x}{2} = \\sqrt{x^2/4}$.\nThe failed hypothesis is continuity of $\\frac{\\partial f}{\\partial y}$.\n\n\\medskip"
    },
    {
      "id": "ps_3_8",
      "problem": "Find every fixed point of $g(x) = x^{2}$ and classify each as attracting or repelling.",
      "solution": " Solve $g(x) = x$:\n\\[ \\work{x^{2} = x \\;\\Longrightarrow\\; x(x-1) = 0 \\;\\Longrightarrow\\; x = 0,\\ 1.} \\]\nClassify with $|g'(x)| = |2x|$:\n\\[ \\work{|g'(0)| = 0 < 1 \\ (\\text{attracting}), \\qquad |g'(1)| = 2 > 1 \\ (\\text{repelling}).} \\]\n\n\\medskip"
    },
    {
      "id": "ps_3_9",
      "problem": "Show that $g(x) = \\cos x$ is a contraction on $[0,1]$, and state what the Banach fixed point theorem then concludes.",
      "solution": " A bound $|g'(x)| \\le k < 1$ on an interval\nmakes $g$ a contraction there. With $g(x) = \\cos x$,\n\\[ \\work{|g'(x)| = |\\sin x|,} \\]\nwhich increases on $[0,1]$ and so is largest at $x = 1$:\n\\[ \\work{|\\sin x| \\le \\sin 1 \\approx 0.841 < 1.} \\]\nThus $g$ is a contraction with $k = \\sin 1$. By Banach, $g$ has a\n\\work{unique} fixed point in $[0,1]$, and iterating cosine from\n\\emph{any} start converges to it.\n\n\\medskip"
    },
    {
      "id": "ps_3_10",
      "problem": "\\strong{(Capstone)} For $\\dfrac{dy}{dx} = y$ with $y(0) = 1$, carry out Picard iteration from $\\varphi_0 = 1$: compute $\\varphi_1$, $\\varphi_2$, $\\varphi_3$, and identify the function the iterates converge to.",
      "solution": " Use $\\varphi_{n+1}(x) = 1 + \\int_0^x \\varphi_n(t)\\,dt$\nfrom $\\varphi_0 = 1$.\n\\[ \\work{\\varphi_1 = 1 + \\int_0^x 1\\,dt = 1 + x.} \\]\n\\[ \\work{\\varphi_2 = 1 + \\int_0^x (1+t)\\,dt = 1 + x + \\frac{x^2}{2}.} \\]\n\\[ \\work{\\varphi_3 = 1 + \\int_0^x \\left(1 + t + \\frac{t^2}{2}\\right)dt = 1 + x + \\frac{x^2}{2} + \\frac{x^3}{6}.} \\]\nThese are the partial sums of the exponential series, so\n\\[ \\work{\\varphi_n \\to 1 + x + \\frac{x^2}{2} + \\frac{x^3}{6} + \\cdots = e^{x},} \\]\nthe true solution of $y' = y$, $y(0) = 1$.\n\n\\vspace{0.8em}"
    }
  ]
}
