{
  "unitNumber": 0,
  "subtitle": "Practice Set: Problems and Complete Solutions",
  "intro": "Work the following ten problems in order. They are graded from reading and classifying an equation, through verifying candidate solutions and applying initial conditions, up to two full physical models. Complete solutions follow in Part III.",
  "takeaway": {
    "title": "Unit 0 Key Takeaway",
    "body": "The whole unit rests on one shift in viewpoint --- the unknown is a\n\\highlight{function}, and the equation pins down its\n\\highlight{rate of change}. You \\highlight{verify} a\ncandidate by substituting it and its derivatives and checking both sides agree\nfor all $x$, and you pass from the \\highlight{general solution} to\none particular curve with an \\highlight{initial condition}. Read\nthe structure first --- order, linearity, and what is changing --- and every\nlater technique in the course has a place to land."
  },
  "problems": [
    {
      "id": "ps_0_1",
      "problem": "Verify that $y = e^{3x}$ is a solution of $\\dfrac{dy}{dx} = 3y$.",
      "solution": " Differentiate the candidate and compare both\nsides.\n\\[ \\work{\\frac{dy}{dx} = 3e^{3x}} \\qquad\\text{and}\\qquad\n   \\work{3y = 3e^{3x}}. \\]\nBoth sides equal $\\work{3e^{3x}}$ for all $x$, so $y = e^{3x}$\nsatisfies the equation.\n\n\\medskip"
    },
    {
      "id": "ps_0_2",
      "problem": "State the order of each equation: \\strong{(a)} $\\dfrac{dy}{dx} + y^{2} = x$, \\quad \\strong{(b)} $\\dfrac{d^{2}y}{dx^{2}} + 3\\dfrac{dy}{dx} + 2y = 0$, \\quad \\strong{(c)} $\\dfrac{d^{3}y}{dx^{3}} + \\left(\\dfrac{dy}{dx}\\right)^{5} = \\sin x$.",
      "solution": " The order is the highest derivative present.\n\\[ \\work{\\text{(a) first order}}, \\quad\n   \\work{\\text{(b) second order}}, \\quad\n   \\work{\\text{(c) third order}}. \\]\nIn (c) the fifth \\emph{power} on $\\frac{dy}{dx}$ is a degree, not an order ---\nthe highest derivative is still the third.\n\n\\medskip"
    },
    {
      "id": "ps_0_3",
      "problem": "Classify each equation as linear or nonlinear, and name the offending term when it is nonlinear: \\strong{(a)} $\\dfrac{dy}{dx} + x^{2}y = e^{x}$, \\quad \\strong{(b)} $\\dfrac{dy}{dx} = y^{2}$, \\quad \\strong{(c)} $\\dfrac{d^{2}y}{dx^{2}} + \\sin y = 0$.",
      "solution": " An equation is linear when $y$ and its\nderivatives appear only to the first power and are never composed inside another\nfunction.\n\\[ \\work{\\text{(a) linear}}, \\quad\n   \\work{\\text{(b) nonlinear: the term } y^{2}}, \\quad\n   \\work{\\text{(c) nonlinear: the term } \\sin y}. \\]\n\n\\medskip"
    },
    {
      "id": "ps_0_4",
      "problem": "The general solution of $\\dfrac{dy}{dx} = 2x$ is $y = x^{2} + C$. Verify it, then find the particular solution satisfying $y(1) = 5$.",
      "solution": " Differentiate to verify, then apply the\ncondition.\n\\[ \\work{\\frac{d}{dx}\\big(x^{2} + C\\big) = 2x} \\qquad\\checkmark \\]\nApply $y(1) = 5$:\n\\[ \\work{5 = (1)^{2} + C \\;\\Longrightarrow\\; C = 4}. \\]\nThe particular solution is $\\work{y = x^{2} + 4}$.\n\n\\medskip"
    },
    {
      "id": "ps_0_5",
      "problem": "Show that $y = Ce^{-2x}$ satisfies $\\dfrac{dy}{dx} + 2y = 0$ for every constant $C$, then find the $C$ for which $y(0) = 4$.",
      "solution": " Differentiate $y = Ce^{-2x}$ and substitute.\n\\[ \\work{\\frac{dy}{dx} = -2Ce^{-2x}} \\]\n\\[ \\work{\\frac{dy}{dx} + 2y = -2Ce^{-2x} + 2Ce^{-2x} = 0} \\qquad\\checkmark \\]\nThe equation holds for every $C$. Apply $y(0) = 4$:\n\\[ \\work{y(0) = C = 4 \\;\\Longrightarrow\\; y = 4e^{-2x}}. \\]\n\n\\medskip"
    },
    {
      "id": "ps_0_6",
      "problem": "Verify that $y = \\cos 2x$ is a solution of the second-order equation $\\dfrac{d^{2}y}{dx^{2}} + 4y = 0$.",
      "solution": " Differentiate twice and substitute.\n\\[ \\work{\\frac{dy}{dx} = -2\\sin 2x}, \\qquad\n   \\work{\\frac{d^{2}y}{dx^{2}} = -4\\cos 2x} \\]\n\\[ \\work{\\frac{d^{2}y}{dx^{2}} + 4y = -4\\cos 2x + 4\\cos 2x = 0} \\qquad\\checkmark \\]\nSo $y = \\cos 2x$ is a solution of the second-order equation.\n\n\\medskip"
    },
    {
      "id": "ps_0_7",
      "problem": "Classify each as an ordinary or a partial differential equation: \\strong{(a)} $\\dfrac{dy}{dt} = ky$, \\quad \\strong{(b)} $\\dfrac{\\partial u}{\\partial t} = \\dfrac{\\partial^{2}u}{\\partial x^{2}}$, \\quad \\strong{(c)} $\\dfrac{d^{2}x}{dt^{2}} + x = 0$.",
      "solution": " An ordinary equation has a single independent\nvariable; a partial equation has several.\n\\[ \\work{\\text{(a) ODE (only } t)}, \\quad\n   \\work{\\text{(b) PDE (}t \\text{ and } x)}, \\quad\n   \\work{\\text{(c) ODE (only } t)}. \\]\n\n\\medskip"
    },
    {
      "id": "ps_0_8",
      "problem": "The general solution of $\\dfrac{dy}{dx} = x + y$ is $y = Ce^{x} - x - 1$. Verify it, then find the particular solution with $y(0) = 2$.",
      "solution": " Differentiate $y = Ce^{x} - x - 1$ and check\nagainst $x + y$.\n\\[ \\work{\\frac{dy}{dx} = Ce^{x} - 1} \\]\n\\[ \\work{x + y = x + \\big(Ce^{x} - x - 1\\big) = Ce^{x} - 1} \\qquad\\checkmark \\]\nThe two agree, so the family solves the equation. Apply $y(0) = 2$:\n\\[ \\work{2 = Ce^{0} - 0 - 1 = C - 1 \\;\\Longrightarrow\\; C = 3} \\]\n\\[ \\work{y = 3e^{x} - x - 1}. \\]\n\n\\medskip"
    },
    {
      "id": "ps_0_9",
      "problem": "\\strong{(Application)} A population grows at a rate proportional to its size, $\\dfrac{dP}{dt} = kP$, with $P(0) = 500$. If the population doubles in $4$ hours, find $k$ and write $P(t)$ explicitly.",
      "solution": " A rate proportional to size gives exponential\ngrowth, $\\work{P(t) = P_{0}e^{kt}}$, and here $P_{0} = 500$:\n\\[ \\work{P(t) = 500\\,e^{kt}}. \\]\nDoubling in $4$ hours means $P(4) = 1000$:\n\\[ \\work{1000 = 500\\,e^{4k} \\;\\Longrightarrow\\; e^{4k} = 2 \\;\\Longrightarrow\\; 4k = \\ln 2} \\]\n\\[ \\work{k = \\frac{\\ln 2}{4}}. \\]\nHence\n\\[ \\work{P(t) = 500\\,e^{(\\ln 2 / 4)\\,t} = 500\\cdot 2^{\\,t/4}}. \\]\n\n\\medskip"
    },
    {
      "id": "ps_0_10",
      "problem": "\\strong{(Application)} A radioactive sample obeys $\\dfrac{dN}{dt} = -\\lambda N$ with $N(0) = N_{0}$. Verify that $N(t) = N_{0}e^{-\\lambda t}$ is a solution, then find $\\lambda$ given a half-life of $10$ years.",
      "solution": " First verify the candidate by\ndifferentiating:\n\\[ \\work{\\frac{dN}{dt} = -\\lambda N_{0}e^{-\\lambda t} = -\\lambda N} \\qquad\\checkmark \\]\nso $N(t) = N_{0}e^{-\\lambda t}$ solves the decay law. A half-life of $10$ years\nmeans $N(10) = \\tfrac{1}{2}N_{0}$:\n\\[ \\work{\\tfrac{1}{2}N_{0} = N_{0}e^{-10\\lambda} \\;\\Longrightarrow\\; e^{-10\\lambda} = \\tfrac{1}{2}} \\]\n\\[ \\work{-10\\lambda = -\\ln 2 \\;\\Longrightarrow\\; \\lambda = \\frac{\\ln 2}{10} \\text{ per year}}. \\]\n\n\\vspace{0.8em}"
    }
  ]
}
