{
  "unitNumber": 14,
  "subtitle": "Practice Set: Problems and Complete Solutions",
  "intro": "Work the following ten problems in order. They climb through linear combinations and bases, the matrix of a transformation, the determinant and its geometric meaning, the similarity transform, the characteristic equation and the trace/determinant shortcut, eigenvectors, the eigen-ansatz, and a capstone that solves a coupled system $\\mathbf{x}'=A\\mathbf{x}$ end to end.",
  "takeaway": {
    "title": "Unit Key Takeaway",
    "body": "Every problem above is one geometric story: a matrix \\emph{moves} space. Its \\highlight{columns} say where the basis lands, its \\highlight{determinant} says how area is scaled and whether orientation flips, and its \\highlight{eigenvectors} mark the directions it merely stretches. Feeding those eigenpairs into $\\mathbf{x}=e^{\\lambda t}\\mathbf{v}$ turns a coupled system into independent exponential modes --- the exact machinery Unit 15 runs on."
  },
  "problems": [
    {
      "id": "ps_14_1",
      "problem": "\\strong{(Linear combination)} Compute the linear combination $2(1,0) + 3(0,1)$.",
      "solution": " Scale each vector and add componentwise:\n\\[ \\work{2(1,0) + 3(0,1) = (2,0) + (0,3) = (2,3).} \\]\nThe scalars stay attached to their own directions; they do not merge into a single axis."
    },
    {
      "id": "ps_14_2",
      "problem": "\\strong{(Basis test)} State the two conditions a set must meet to be a basis, then decide whether $(1,0)$ and $(2,0)$ form a basis of $\\mathbb{R}^2$.",
      "solution": " A basis must be \\emph{linearly independent} and must \\emph{span} the space. The vectors $(1,0)$ and $(2,0)$ are parallel, since $(2,0)=2(1,0)$, so they are dependent and span only the $x$-axis:\n\\[ \\work{\\operatorname{span}\\{(1,0),(2,0)\\} = \\{(t,0)\\} \\neq \\mathbb{R}^2.} \\]\nThey are \\strong{not} a basis of $\\mathbb{R}^2$."
    },
    {
      "id": "ps_14_3",
      "problem": "\\strong{(Matrix of a transformation)} For the matrix $A$ with rows $(1,2)$ and $(3,4)$, compute the image $A\\mathbf{x}$ of $\\mathbf{x}=(1,1)$.",
      "solution": " Dot each row with the input $\\mathbf{x}=(1,1)$:\n\\[ \\work{A\\mathbf{x} = \\begin{pmatrix} 1 & 2 \\\\ 3 & 4 \\end{pmatrix}\\begin{pmatrix} 1 \\\\ 1 \\end{pmatrix} = \\begin{pmatrix} 1+2 \\\\ 3+4 \\end{pmatrix} = \\begin{pmatrix} 3 \\\\ 7 \\end{pmatrix}.} \\]"
    },
    {
      "id": "ps_14_4",
      "problem": "\\strong{(Determinant, compute)} Find the determinant of the matrix with rows $(3,1)$ and $(2,4)$, and state the factor by which it scales area.",
      "solution": " Use $\\det = ad-bc$ with $a=3,b=1,c=2,d=4$:\n\\[ \\work{\\det A = (3)(4) - (1)(2) = 12 - 2 = 10.} \\]\nThe map scales every area by a factor of $\\lvert\\det A\\rvert = 10$, and since $\\det A>0$ it preserves orientation."
    },
    {
      "id": "ps_14_5",
      "problem": "\\strong{(Determinant, meaning)} Compute the determinant of the matrix with rows $(1,2)$ and $(2,4)$. Is the matrix invertible? What does this say about its columns?",
      "solution": " Compute the determinant:\n\\[ \\work{\\det\\begin{pmatrix} 1 & 2 \\\\ 2 & 4 \\end{pmatrix} = (1)(4) - (2)(2) = 4 - 4 = 0.} \\]\nA zero determinant means the matrix is \\strong{not invertible}: it collapses the plane onto a line, so its columns are linearly dependent (indeed $(2,4)=2(1,2)$)."
    },
    {
      "id": "ps_14_6",
      "problem": "\\strong{(Change of basis)} Write the formula that expresses a matrix $A$ in the basis given by a change-of-basis matrix $P$, and state what makes the result diagonal.",
      "solution": " The similarity transform rewrites $A$ in the new coordinates:\n\\[ \\work{B = P^{-1} A P,} \\]\nwhere the columns of $P$ are the new basis vectors in the old coordinates. If those columns are eigenvectors of $A$, then $B$ is \\strong{diagonal}, with the eigenvalues on the diagonal."
    },
    {
      "id": "ps_14_7",
      "problem": "\\strong{(Characteristic equation)} Write the $2\\times 2$ characteristic equation in terms of the trace and determinant, then find the eigenvalues of the matrix with rows $(2,1)$ and $(1,2)$.",
      "solution": " The characteristic equation is\n\\[ \\work{\\lambda^2 - (\\operatorname{tr}A)\\lambda + \\det A = 0.} \\]\nFor rows $(2,1),(1,2)$: $\\operatorname{tr}A=4$, $\\det A=3$, so\n\\[ \\work{\\lambda^2 - 4\\lambda + 3 = (\\lambda-3)(\\lambda-1) = 0 \\;\\Rightarrow\\; \\lambda = 3,\\ 1.} \\]"
    },
    {
      "id": "ps_14_8",
      "problem": "\\strong{(Eigenvectors)} For that same matrix (rows $(2,1)$, $(1,2)$), find an eigenvector for each eigenvalue.",
      "solution": " Solve $(A-\\lambda I)\\mathbf{v}=\\mathbf{0}$ for each eigenvalue:\n\\[ \\work{\\lambda=3:\\ \\begin{pmatrix} -1 & 1 \\\\ 1 & -1 \\end{pmatrix}\\mathbf{v}=\\mathbf{0} \\Rightarrow \\mathbf{v}_1=(1,1);} \\]\n\\[ \\work{\\lambda=1:\\ \\begin{pmatrix} 1 & 1 \\\\ 1 & 1 \\end{pmatrix}\\mathbf{v}=\\mathbf{0} \\Rightarrow \\mathbf{v}_2=(1,-1).} \\]"
    },
    {
      "id": "ps_14_9",
      "problem": "\\strong{(Eigen-ansatz)} Show that substituting $\\mathbf{x}=e^{\\lambda t}\\mathbf{v}$ into $\\mathbf{x}'=A\\mathbf{x}$ produces the eigenvalue equation $A\\mathbf{v}=\\lambda\\mathbf{v}$.",
      "solution": " Differentiate the trial $\\mathbf{x}=e^{\\lambda t}\\mathbf{v}$ (with $\\mathbf{v}$ constant) and substitute:\n\\[ \\work{\\mathbf{x}' = \\lambda e^{\\lambda t}\\mathbf{v}, \\qquad A\\mathbf{x} = e^{\\lambda t} A\\mathbf{v}.} \\]\nSetting $\\mathbf{x}'=A\\mathbf{x}$ and cancelling the nonzero scalar $e^{\\lambda t}$ leaves\n\\[ \\work{\\lambda\\mathbf{v} = A\\mathbf{v},} \\]\nexactly the eigenvalue problem."
    },
    {
      "id": "ps_14_10",
      "problem": "\\strong{(Capstone --- solve a system)} Using the eigenpairs from Problems 7--8, write the general solution of $\\mathbf{x}'=A\\mathbf{x}$ for $A$ with rows $(2,1)$ and $(1,2)$, and classify the equilibrium at the origin.",
      "solution": " Each eigenpair contributes one exponential mode; superpose them:\n\\[ \\work{\\mathbf{x}(t) = c_1 e^{3t}\\begin{pmatrix}1\\\\1\\end{pmatrix} + c_2 e^{t}\\begin{pmatrix}1\\\\-1\\end{pmatrix}.} \\]\nBoth eigenvalues are real and positive, so every trajectory grows without bound: the origin is an \\strong{unstable node} (a source)."
    }
  ]
}
